{
  "$schema": "./team-manifest.schema.json",
  "schemaVersion": 1,
  "inventory": {
    "agentCount": 14,
    "physicalSkillCount": 793,
    "skillEntrypoint": "SKILL.md",
    "symlinkPolicy": "forbid"
  },
  "agents": [
    {
      "id": "ceo",
      "name": "CEO (Elon Musk)",
      "path": "agents/ceo",
      "skills": {
        "required": [
          "ads",
          "backtest-expert",
          "brainstorming",
          "cold-email-sequence-generator",
          "competitive-analysis",
          "content-ops-toolkit",
          "context-manager",
          "contract-review",
          "dashboard-builder",
          "deep-research",
          "deployment-automation",
          "dispatching-parallel-agents",
          "e2e-testing",
          "executing-plans",
          "feature-requirements-clarification",
          "financial-analyst",
          "gdpr-dsgvo-expert",
          "google-analytics",
          "healthcheck",
          "kubernetes-specialist",
          "lead-intelligence",
          "legal-risk-assessment",
          "meeting-insights-analyzer",
          "okr",
          "polymarket-api",
          "postgresql-database-engineering",
          "prd-development",
          "prioritization-funnel",
          "project-planner",
          "react-expert",
          "roadmap-planning",
          "startup-metrics-framework",
          "systematic-debugging",
          "tdd-workflow",
          "team-coordinator",
          "token-budget-advisor",
          "traffic-acquisition",
          "user-story",
          "verification-before-completion",
          "video-marketing",
          "web-search",
          "writing-skills",
          "xiaohongshu-growth"
        ],
        "optional": [],
        "recommendedExternal": [
          "daily-rhythm",
          "docker-containerization",
          "generating-trading-signals",
          "office-hours",
          "planning-with-files",
          "taskflow",
          "xiaohongshu-viral-copy"
        ]
      }
    },
    {
      "id": "cto",
      "name": "CTO (Jensen Huang)",
      "path": "agents/cto",
      "skills": {
        "required": [
          "api-design",
          "api-design-patterns",
          "api-provider-status",
          "architecture-decision",
          "architecture-patterns",
          "auth-manager",
          "browser-profile-guide",
          "browser-use",
          "deployment-automation",
          "docker-essentials",
          "github-automation",
          "inference-optimizer",
          "kubernetes-specialist",
          "model-fallback",
          "model-provider-manager",
          "nginx-configuration",
          "provider-key-manager",
          "render-automation",
          "sentry-automation",
          "supabase-automation",
          "token-reporter",
          "vercel-automation"
        ],
        "optional": [],
        "recommendedExternal": [
          "docker-development",
          "openclaw-workspace-audit",
          "token-guard"
        ]
      }
    },
    {
      "id": "pe",
      "name": "PE (Linus Torvalds)",
      "path": "agents/pe",
      "skills": {
        "required": [
          "api-design",
          "auth-system",
          "browser-profile-guide",
          "claude-code-runner",
          "cli-developer",
          "code-review-quality",
          "codex-cc-guide",
          "coding-agent-backup",
          "css-ninja",
          "db-migrator",
          "deployment-automation",
          "docker-essentials",
          "e2e-testing",
          "finishing-a-development-branch",
          "gh-issues",
          "ghost-scan-code",
          "github",
          "kubernetes-specialist",
          "react-architect",
          "react-expert",
          "receiving-code-review",
          "redis-inspect",
          "requesting-code-review",
          "security-audit",
          "sp-condition-based-waiting",
          "sp-subagent-driven-development",
          "sp-test-driven-development",
          "sp-testing-anti-patterns",
          "sp-using-git-worktrees",
          "sql-optimization",
          "systematic-debugging",
          "tdd-workflow",
          "verification-before-completion"
        ],
        "optional": [],
        "recommendedExternal": [
          "ci-cd-pipeline-builder",
          "docker-containerization",
          "openclaw-claude-code"
        ]
      }
    },
    {
      "id": "cpo",
      "name": "CPO (Steve Jobs)",
      "path": "agents/cpo",
      "skills": {
        "required": [
          "brand-identity",
          "frontend-design-ultimate",
          "prd-development",
          "self-improving",
          "user-story"
        ],
        "optional": [],
        "recommendedExternal": [
          "product-roadmap"
        ]
      }
    },
    {
      "id": "cqo",
      "name": "CQO (Jim Simons)",
      "path": "agents/cqo",
      "skills": {
        "required": [
          "deep-research",
          "polymarket-api",
          "polymarket-copy-tracker",
          "polymarket-profit",
          "trade-prediction-markets"
        ],
        "optional": [],
        "recommendedExternal": [
          "backtesting-system",
          "portfolio-optimization",
          "risk-management"
        ]
      }
    },
    {
      "id": "cmo",
      "name": "CMO (David Ogilvy)",
      "path": "agents/cmo",
      "skills": {
        "required": [
          "competitor-alternatives",
          "market-research",
          "seo-audit"
        ],
        "optional": [],
        "recommendedExternal": [
          "competitor-analysis",
          "growth-hacking",
          "marketing-strategy"
        ]
      }
    },
    {
      "id": "cfo",
      "name": "CFO (Warren Buffett)",
      "path": "agents/cfo",
      "skills": {
        "required": [],
        "optional": [],
        "recommendedExternal": [
          "budget-optimization",
          "cost-analysis",
          "financial-modeling"
        ]
      }
    },
    {
      "id": "cdo",
      "name": "CDO (Nate Silver)",
      "path": "agents/cdo",
      "skills": {
        "required": [
          "api-gateway",
          "apify-ultimate-scraper",
          "web-search"
        ],
        "optional": [],
        "recommendedExternal": [
          "data-pipeline",
          "duckdb-analytics",
          "mineru-extract"
        ]
      }
    },
    {
      "id": "cco",
      "name": "CCO (MrBeast)",
      "path": "agents/cco",
      "skills": {
        "required": [
          "ai-marketing-videos",
          "content-cover-gen",
          "douyin-publisher",
          "douyin-smart-publish",
          "jimeng-digital-human",
          "jimeng-login",
          "jimeng-storyboard",
          "nano-banana-pro",
          "openai-whisper",
          "video-merge-send",
          "wechat-toolkit",
          "x-articles",
          "xhs-publisher",
          "xiaohongshu-growth"
        ],
        "optional": [],
        "recommendedExternal": [
          "content-distributor",
          "content-pipeline",
          "douyin-publish",
          "gzh-publisher",
          "seo-writing"
        ]
      }
    },
    {
      "id": "clo",
      "name": "CLO (Alan Dershowitz)",
      "path": "agents/clo",
      "skills": {
        "required": [
          "legal-review"
        ],
        "optional": [],
        "recommendedExternal": [
          "compliance-check",
          "contract-analysis"
        ]
      }
    },
    {
      "id": "cro",
      "name": "CRO (Richard Feynman)",
      "path": "agents/cro",
      "skills": {
        "required": [
          "deep-research",
          "sp-tracing-knowledge-lineages",
          "tavily-search",
          "web-search"
        ],
        "optional": [],
        "recommendedExternal": [
          "scientific-method"
        ]
      }
    },
    {
      "id": "cso",
      "name": "CSO (Michael Dell)",
      "path": "agents/cso",
      "skills": {
        "required": [
          "competitor-alternatives",
          "crm-automation",
          "self-improving",
          "skill-finder-cn"
        ],
        "optional": [],
        "recommendedExternal": [
          "customer-analysis",
          "sales-strategy"
        ]
      }
    },
    {
      "id": "coo",
      "name": "COO (Andy Grove)",
      "path": "agents/coo",
      "skills": {
        "required": [
          "browser-profile-guide",
          "cost-optimization",
          "healthcheck",
          "sp-defense-in-depth",
          "sp-root-cause-tracing",
          "sp-systematic-debugging",
          "sp-verification-before-completion"
        ],
        "optional": [],
        "recommendedExternal": [
          "incident-response",
          "monitoring"
        ]
      }
    },
    {
      "id": "governor",
      "name": "Governor",
      "path": "agents/governor",
      "skills": {
        "required": [
          "agent-skills-audit",
          "kpi-dashboard-design",
          "okr",
          "quality-convergence-engine",
          "security-audit",
          "silicon-performance-reviewer"
        ],
        "optional": [],
        "recommendedExternal": []
      }
    }
  ],
  "kits": [
    {
      "id": "solo-founder",
      "agents": [
        "ceo",
        "pe",
        "cco"
      ]
    },
    {
      "id": "content-creator",
      "agents": [
        "cco",
        "cdo",
        "cmo"
      ]
    },
    {
      "id": "quant-trader",
      "agents": [
        "cqo",
        "cdo",
        "cfo"
      ]
    },
    {
      "id": "full-team",
      "agents": [
        "ceo",
        "cto",
        "pe",
        "cpo",
        "cqo",
        "cmo",
        "cfo",
        "cdo",
        "cco",
        "clo",
        "cro",
        "cso",
        "coo",
        "governor"
      ]
    }
  ]
}
